<?xml version="1.0" encoding="UTF-8"?>

<vehicleDefinitions xmlns="http://www.matsim.org/files/dtd"
 xmlns:xsi="http://www.w3.org/2001/XMLSchema-instance"
 xsi:schemaLocation="http://www.matsim.org/files/dtd http://www.matsim.org/files/dtd/vehicleDefinitions_v1.0.xsd">
	<vehicleType id="1">
		<description>Bus</description>
		<capacity>
			<seats persons="41"/>
			<standingRoom persons="40"/>
		</capacity>
		<length meter="15.0"/>
	</vehicleType>
	<vehicle id="tr_0" type="1"/>
	<vehicle id="tr_1" type="1"/>
	<vehicle id="tr_2" type="1"/>
	<vehicle id="tr_3" type="1"/>
</vehicleDefinitions>
